{
  "$schema": "http://json-schema.org/draft-07/schema#",
  "$id": "https://github.com/rayners/fvtt-seasons-and-stars/schemas/calendar-variants-v1.0.0.json",
  "title": "Seasons & Stars External Calendar Variants Schema",
  "description": "JSON schema for Seasons & Stars external calendar variants format v1.0.0",
  "type": "object",
  "required": ["id", "baseCalendar", "variants"],
  "additionalProperties": false,
  "properties": {
    "id": {
      "type": "string",
      "pattern": "^[a-z0-9-]+-variants$",
      "minLength": 10,
      "maxLength": 60,
      "description": "Unique identifier for the variant file (must end with '-variants')"
    },
    "baseCalendar": {
      "type": "string",
      "pattern": "^[a-z0-9-]+$",
      "minLength": 1,
      "maxLength": 50,
      "description": "ID of the existing calendar to build variants from"
    },
    "name": {
      "type": "string",
      "minLength": 1,
      "maxLength": 100,
      "description": "Display name for the variant collection"
    },
    "description": {
      "type": "string",
      "maxLength": 500,
      "description": "Description of the variant collection"
    },
    "author": {
      "type": "string",
      "maxLength": 100,
      "description": "Author of the variant collection"
    },
    "version": {
      "type": "string",
      "pattern": "^\\d+\\.\\d+\\.\\d+([+-][a-zA-Z0-9.-]+)?$",
      "description": "Version of the variant collection"
    },
    "translations": {
      "type": "object",
      "minProperties": 1,
      "patternProperties": {
        "^[a-z]{2}(-[A-Z]{2})?$": {
          "type": "object",
          "required": ["label"],
          "additionalProperties": false,
          "properties": {
            "label": {
              "type": "string",
              "minLength": 1,
              "maxLength": 100,
              "description": "Display label for the variant collection"
            },
            "description": {
              "type": "string",
              "maxLength": 500,
              "description": "Optional description of the variant collection"
            }
          }
        }
      },
      "additionalProperties": false,
      "description": "Localization data for the variant collection"
    },
    "variants": {
      "type": "object",
      "minProperties": 1,
      "patternProperties": {
        "^[a-z0-9-]+$": {
          "type": "object",
          "required": ["name"],
          "additionalProperties": false,
          "properties": {
            "name": {
              "type": "string",
              "minLength": 1,
              "maxLength": 100,
              "description": "Display name for the variant"
            },
            "description": {
              "type": "string",
              "maxLength": 500,
              "description": "Description of the variant"
            },
            "default": {
              "type": "boolean",
              "default": false,
              "description": "Whether this is the default variant within the themed collection"
            },
            "config": {
              "type": "object",
              "properties": {
                "yearOffset": {
                  "type": "integer",
                  "description": "Year offset for calculations"
                }
              },
              "additionalProperties": true,
              "description": "Configuration options for the variant"
            },
            "overrides": {
              "type": "object",
              "additionalProperties": false,
              "properties": {
                "year": {
                  "type": "object",
                  "additionalProperties": false,
                  "properties": {
                    "prefix": {
                      "type": "string",
                      "maxLength": 50,
                      "description": "Text before year number"
                    },
                    "suffix": {
                      "type": "string",
                      "maxLength": 50,
                      "description": "Text after year number"
                    },
                    "epoch": {
                      "type": "integer",
                      "minimum": 0,
                      "description": "Starting year for calculations"
                    },
                    "currentYear": {
                      "type": "integer",
                      "minimum": 0,
                      "description": "Current year for calculations"
                    }
                  }
                },
                "months": {
                  "type": "object",
                  "patternProperties": {
                    "^.+$": {
                      "type": "object",
                      "additionalProperties": false,
                      "properties": {
                        "name": {
                          "type": "string",
                          "minLength": 1,
                          "maxLength": 50,
                          "description": "New name for the month"
                        },
                        "description": {
                          "type": "string",
                          "maxLength": 200,
                          "description": "New description for the month"
                        },
                        "abbreviation": {
                          "type": "string",
                          "minLength": 1,
                          "maxLength": 10,
                          "description": "New abbreviation for the month"
                        }
                      }
                    }
                  },
                  "additionalProperties": false,
                  "description": "Month name/description overrides keyed by original month name"
                },
                "weekdays": {
                  "type": "object",
                  "patternProperties": {
                    "^.+$": {
                      "type": "object",
                      "additionalProperties": false,
                      "properties": {
                        "name": {
                          "type": "string",
                          "minLength": 1,
                          "maxLength": 50,
                          "description": "New name for the weekday"
                        },
                        "description": {
                          "type": "string",
                          "maxLength": 200,
                          "description": "New description for the weekday"
                        },
                        "abbreviation": {
                          "type": "string",
                          "minLength": 1,
                          "maxLength": 10,
                          "description": "New abbreviation for the weekday"
                        }
                      }
                    }
                  },
                  "additionalProperties": false,
                  "description": "Weekday name/description overrides keyed by original weekday name"
                },
                "moons": {
                  "type": "array",
                  "items": {
                    "type": "object",
                    "additionalProperties": true
                  },
                  "description": "Override for celestial bodies"
                },
                "dateFormats": {
                  "type": "object",
                  "additionalProperties": true,
                  "description": "Override for date formatting templates"
                }
              },
              "description": "Property overrides for the variant"
            }
          }
        }
      },
      "additionalProperties": false,
      "description": "Variant definitions keyed by variant ID"
    },
    "metadata": {
      "type": "object",
      "additionalProperties": false,
      "properties": {
        "license": {
          "type": "string",
          "maxLength": 50,
          "description": "License for the variant collection"
        },
        "homepage": {
          "type": "string",
          "format": "uri",
          "description": "Homepage URL for the variant collection"
        },
        "repository": {
          "type": "string",
          "format": "uri",
          "description": "Repository URL for the variant collection"
        },
        "lastUpdated": {
          "type": "string",
          "format": "date-time",
          "description": "ISO 8601 timestamp of last update"
        }
      },
      "description": "Additional metadata for the variant collection"
    }
  }
}
