{
  "id": "gregorian-star-trek-variants",
  "baseCalendar": "gregorian",
  "name": "Star Trek Calendar Variants",
  "description": "Star Trek universe calendar variants based on the Gregorian calendar system",
  "author": "Seasons & Stars",
  "version": "1.0.0",
  "translations": {
    "en": {
      "label": "Star Trek Calendar Variants",
      "description": "Calendar variants for Star Trek gaming sessions"
    }
  },
  "variants": {
    "earth-stardate": {
      "name": "Earth Stardate System",
      "description": "Earth-based stardate calendar for Star Trek campaigns",
      "default": true,
      "config": {
        "yearOffset": 2323
      },
      "overrides": {
        "year": {
          "prefix": "Stardate ",
          "suffix": ""
        }
      }
    },
    "vulcan-calendar": {
      "name": "Vulcan Calendar",
      "description": "Traditional Vulcan calendar system",
      "config": {
        "yearOffset": 2161
      },
      "overrides": {
        "year": {
          "prefix": "",
          "suffix": " V.S."
        },
        "months": {
          "January": {
            "name": "T'Keth",
            "description": "First month in Vulcan calendar"
          },
          "February": {
            "name": "T'Ket",
            "description": "Second month in Vulcan calendar"
          },
          "March": {
            "name": "T'Ketheris",
            "description": "Third month in Vulcan calendar"
          },
          "April": {
            "name": "T'Keithen",
            "description": "Fourth month in Vulcan calendar"
          },
          "May": {
            "name": "T'Kesava",
            "description": "Fifth month in Vulcan calendar"
          },
          "June": {
            "name": "Khuti",
            "description": "Sixth month in Vulcan calendar"
          },
          "July": {
            "name": "Ta'Krat",
            "description": "Seventh month in Vulcan calendar"
          },
          "August": {
            "name": "T'Kevas",
            "description": "Eighth month in Vulcan calendar"
          },
          "September": {
            "name": "Sutai",
            "description": "Ninth month in Vulcan calendar"
          },
          "October": {
            "name": "T'Kuht",
            "description": "Tenth month in Vulcan calendar"
          },
          "November": {
            "name": "T'Rilis",
            "description": "Eleventh month in Vulcan calendar"
          },
          "December": {
            "name": "Ta'Khetar",
            "description": "Twelfth month in Vulcan calendar"
          }
        }
      }
    },
    "klingon-calendar": {
      "name": "Klingon Calendar",
      "description": "Traditional Klingon warrior calendar",
      "config": {
        "yearOffset": 2151
      },
      "overrides": {
        "year": {
          "prefix": "",
          "suffix": " K.Y."
        },
        "months": {
          "January": {
            "name": "Maktag",
            "description": "Month of battle preparation"
          },
          "February": {
            "name": "Jagh",
            "description": "Month of enemies"
          },
          "March": {
            "name": "DIch",
            "description": "Month of duty"
          },
          "April": {
            "name": "naQ",
            "description": "Month of strategy"
          },
          "May": {
            "name": "Hung",
            "description": "Month of honor"
          },
          "June": {
            "name": "DIlo'",
            "description": "Month of the warrior"
          },
          "July": {
            "name": "baH",
            "description": "Month of weapons"
          },
          "August": {
            "name": "DIch nugh",
            "description": "Month of loyal society"
          },
          "September": {
            "name": "DIch DIch",
            "description": "Month of true duty"
          },
          "October": {
            "name": "DIch Hoch",
            "description": "Month of all duty"
          },
          "November": {
            "name": "noD",
            "description": "Month of revenge"
          },
          "December": {
            "name": "DIch naDev",
            "description": "Month of duty's end"
          }
        },
        "weekdays": {
          "Sunday": {
            "name": "jup",
            "description": "Day of the warrior"
          },
          "Monday": {
            "name": "ghItlh",
            "description": "Day of writing"
          },
          "Tuesday": {
            "name": "jaq",
            "description": "Day of the blade"
          },
          "Wednesday": {
            "name": "nugh",
            "description": "Day of society"
          },
          "Thursday": {
            "name": "ram",
            "description": "Day of insignificance"
          },
          "Friday": {
            "name": "Hov",
            "description": "Day of the star"
          },
          "Saturday": {
            "name": "lojmit",
            "description": "Day of the threshold"
          }
        }
      }
    },
    "federation-standard": {
      "name": "Federation Standard Calendar",
      "description": "United Federation of Planets standard calendar with comprehensive stardate formatting",
      "default": false,
      "config": {
        "yearOffset": 2161
      },
      "overrides": {
        "year": {
          "prefix": "",
          "suffix": ""
        },
        "dateFormats": {
          "federation": "{{month:abbr}} {{day}}, {{year}}",
          "tos-stardate": "{{math year op='subtract' value=1300}}.{{dayOfYear}}",
          "tng-stardate": "{{stardate year prefix='47' baseYear=2370 dayOfYear=dayOfYear precision=1}}",
          "ds9-stardate": "{{stardate year prefix='52' baseYear=2375 dayOfYear=dayOfYear precision=1}}",
          "voyager-stardate": "{{stardate year prefix='53' baseYear=2376 dayOfYear=dayOfYear precision=1}}",
          "enterprise-stardate": "{{stardate year prefix='0' baseYear=2151 dayOfYear=dayOfYear precision=2}}",
          "starfleet": "Stardate {{dateFmt:tng-stardate}}",
          "tos": "Stardate {{dateFmt:tos-stardate}}",
          "tng": "Stardate {{dateFmt:tng-stardate}}",
          "ds9": "Stardate {{dateFmt:ds9-stardate}}",
          "voyager": "Stardate {{dateFmt:voyager-stardate}}",
          "enterprise": "Stardate {{dateFmt:enterprise-stardate}}",
          "short": "{{month:abbr}} {{day}}",
          "long": "{{weekday:name}}, {{month:name}} {{day:ordinal}}, {{year}}",
          "date": "{{weekday:name}}, {{month:name}} {{day:ordinal}}, {{year}}",
          "time": "{{hour:pad}}:{{minute:pad}}:{{second:pad}} UTC",
          "datetime": "{{dateFmt:date}} at {{dateFmt:time}}",
          "official": "Federation Standard Date: {{month:name}} {{day:ordinal}}, {{year}}",
          "command-log": "{{dateFmt:tng}} - {{dateFmt:federation}}",
          "diplomatic": "{{dateFmt:federation}} ({{dateFmt:tng-stardate}})",
          "variants": {
            "command": {
              "short": "SD {{dateFmt:tng-stardate}}",
              "long": "{{dateFmt:tng}} - {{dateFmt:federation}}"
            },
            "civilian": {
              "short": "{{month:abbr}} {{day}}/{{year}}",
              "long": "{{dateFmt:federation}} ({{dateFmt:starfleet}})"
            },
            "temporal": {
              "tos": "TOS Era: {{dateFmt:tos}}",
              "tng": "TNG Era: {{dateFmt:tng}}",
              "ds9": "DS9 Era: {{dateFmt:ds9}}",
              "voyager": "VOY Era: {{dateFmt:voyager}}"
            }
          },
          "widgets": {
            "mini": "SD {{dateFmt:tng-stardate}}",
            "main": "{{weekday:abbr}}, {{month:name}} {{day:ordinal}}",
            "grid": "{{day}}"
          }
        }
      }
    }
  }
}
